{
  "meta": {
    "schema": {
      "name": "kraken-docgraph",
      "version": 1
    },
    "generated_at": "1770450926",
    "tool": {
      "name": "kraken-docgen",
      "version": "0.9.2"
    },
    "source": {
      "project": "kraken-lang/kraken",
      "revision": "HEAD"
    }
  },
  "index": {
    "node_kinds": [
      "keyword",
      "operator",
      "symbol",
      "tooling",
      "type"
    ],
    "tags": [
      "cli",
      "container",
      "control-flow",
      "declaration",
      "function",
      "generics",
      "keyword",
      "literal",
      "macro",
      "modifier",
      "module",
      "operator",
      "primitive",
      "special",
      "stdlib",
      "tooling",
      "type"
    ],
    "search": {
      "entries": [
        {
          "node_id": "keyword.if",
          "title": "`if` keyword",
          "kind": "keyword",
          "path": "keywords/if",
          "tokens": [
            "if",
            "keyword",
            "control-flow"
          ]
        },
        {
          "node_id": "keyword.else",
          "title": "`else` keyword",
          "kind": "keyword",
          "path": "keywords/else",
          "tokens": [
            "else",
            "keyword",
            "control-flow"
          ]
        },
        {
          "node_id": "keyword.match",
          "title": "`match` keyword",
          "kind": "keyword",
          "path": "keywords/match",
          "tokens": [
            "match",
            "keyword",
            "control-flow"
          ]
        },
        {
          "node_id": "keyword.for",
          "title": "`for` keyword",
          "kind": "keyword",
          "path": "keywords/for",
          "tokens": [
            "for",
            "keyword",
            "control-flow"
          ]
        },
        {
          "node_id": "keyword.while",
          "title": "`while` keyword",
          "kind": "keyword",
          "path": "keywords/while",
          "tokens": [
            "while",
            "keyword",
            "control-flow"
          ]
        },
        {
          "node_id": "keyword.do",
          "title": "`do` keyword",
          "kind": "keyword",
          "path": "keywords/do",
          "tokens": [
            "do",
            "keyword",
            "control-flow"
          ]
        },
        {
          "node_id": "keyword.break",
          "title": "`break` keyword",
          "kind": "keyword",
          "path": "keywords/break",
          "tokens": [
            "break",
            "keyword",
            "control-flow"
          ]
        },
        {
          "node_id": "keyword.continue",
          "title": "`continue` keyword",
          "kind": "keyword",
          "path": "keywords/continue",
          "tokens": [
            "continue",
            "keyword",
            "control-flow"
          ]
        },
        {
          "node_id": "keyword.return",
          "title": "`return` keyword",
          "kind": "keyword",
          "path": "keywords/return",
          "tokens": [
            "return",
            "keyword",
            "control-flow"
          ]
        },
        {
          "node_id": "keyword.fn",
          "title": "`fn` keyword",
          "kind": "keyword",
          "path": "keywords/fn",
          "tokens": [
            "fn",
            "keyword",
            "declaration"
          ]
        },
        {
          "node_id": "keyword.let",
          "title": "`let` keyword",
          "kind": "keyword",
          "path": "keywords/let",
          "tokens": [
            "let",
            "keyword",
            "declaration"
          ]
        },
        {
          "node_id": "keyword.const",
          "title": "`const` keyword",
          "kind": "keyword",
          "path": "keywords/const",
          "tokens": [
            "const",
            "keyword",
            "declaration"
          ]
        },
        {
          "node_id": "keyword.struct",
          "title": "`struct` keyword",
          "kind": "keyword",
          "path": "keywords/struct",
          "tokens": [
            "struct",
            "keyword",
            "declaration"
          ]
        },
        {
          "node_id": "keyword.enum",
          "title": "`enum` keyword",
          "kind": "keyword",
          "path": "keywords/enum",
          "tokens": [
            "enum",
            "keyword",
            "declaration"
          ]
        },
        {
          "node_id": "keyword.trait",
          "title": "`trait` keyword",
          "kind": "keyword",
          "path": "keywords/trait",
          "tokens": [
            "trait",
            "keyword",
            "declaration"
          ]
        },
        {
          "node_id": "keyword.impl",
          "title": "`impl` keyword",
          "kind": "keyword",
          "path": "keywords/impl",
          "tokens": [
            "impl",
            "keyword",
            "declaration"
          ]
        },
        {
          "node_id": "keyword.type",
          "title": "`type` keyword",
          "kind": "keyword",
          "path": "keywords/type",
          "tokens": [
            "type",
            "keyword",
            "declaration"
          ]
        },
        {
          "node_id": "keyword.union",
          "title": "`union` keyword",
          "kind": "keyword",
          "path": "keywords/union",
          "tokens": [
            "union",
            "keyword",
            "declaration"
          ]
        },
        {
          "node_id": "keyword.class",
          "title": "`class` keyword",
          "kind": "keyword",
          "path": "keywords/class",
          "tokens": [
            "class",
            "keyword",
            "declaration"
          ]
        },
        {
          "node_id": "keyword.interface",
          "title": "`interface` keyword",
          "kind": "keyword",
          "path": "keywords/interface",
          "tokens": [
            "interface",
            "keyword",
            "declaration"
          ]
        },
        {
          "node_id": "keyword.module",
          "title": "`module` keyword",
          "kind": "keyword",
          "path": "keywords/module",
          "tokens": [
            "module",
            "keyword",
            "module"
          ]
        },
        {
          "node_id": "keyword.import",
          "title": "`import` keyword",
          "kind": "keyword",
          "path": "keywords/import",
          "tokens": [
            "import",
            "keyword",
            "module"
          ]
        },
        {
          "node_id": "keyword.pub",
          "title": "`pub` keyword",
          "kind": "keyword",
          "path": "keywords/pub",
          "tokens": [
            "pub",
            "keyword",
            "modifier"
          ]
        },
        {
          "node_id": "keyword.priv",
          "title": "`priv` keyword",
          "kind": "keyword",
          "path": "keywords/priv",
          "tokens": [
            "priv",
            "keyword",
            "modifier"
          ]
        },
        {
          "node_id": "keyword.static",
          "title": "`static` keyword",
          "kind": "keyword",
          "path": "keywords/static",
          "tokens": [
            "static",
            "keyword",
            "modifier"
          ]
        },
        {
          "node_id": "keyword.async",
          "title": "`async` keyword",
          "kind": "keyword",
          "path": "keywords/async",
          "tokens": [
            "async",
            "keyword",
            "modifier"
          ]
        },
        {
          "node_id": "keyword.await",
          "title": "`await` keyword",
          "kind": "keyword",
          "path": "keywords/await",
          "tokens": [
            "await",
            "keyword",
            "modifier"
          ]
        },
        {
          "node_id": "keyword.spawn",
          "title": "`spawn` keyword",
          "kind": "keyword",
          "path": "keywords/spawn",
          "tokens": [
            "spawn",
            "keyword",
            "modifier"
          ]
        },
        {
          "node_id": "keyword.ref",
          "title": "`ref` keyword",
          "kind": "keyword",
          "path": "keywords/ref",
          "tokens": [
            "ref",
            "keyword",
            "modifier"
          ]
        },
        {
          "node_id": "keyword.mut",
          "title": "`mut` keyword",
          "kind": "keyword",
          "path": "keywords/mut",
          "tokens": [
            "mut",
            "keyword",
            "modifier"
          ]
        },
        {
          "node_id": "keyword.move",
          "title": "`move` keyword",
          "kind": "keyword",
          "path": "keywords/move",
          "tokens": [
            "move",
            "keyword",
            "modifier"
          ]
        },
        {
          "node_id": "keyword.unsafe",
          "title": "`unsafe` keyword",
          "kind": "keyword",
          "path": "keywords/unsafe",
          "tokens": [
            "unsafe",
            "keyword",
            "modifier"
          ]
        },
        {
          "node_id": "keyword.true",
          "title": "`true` keyword",
          "kind": "keyword",
          "path": "keywords/true",
          "tokens": [
            "true",
            "keyword",
            "literal"
          ]
        },
        {
          "node_id": "keyword.false",
          "title": "`false` keyword",
          "kind": "keyword",
          "path": "keywords/false",
          "tokens": [
            "false",
            "keyword",
            "literal"
          ]
        },
        {
          "node_id": "keyword.null",
          "title": "`null` keyword",
          "kind": "keyword",
          "path": "keywords/null",
          "tokens": [
            "null",
            "keyword",
            "literal"
          ]
        },
        {